Question,Always,Most of the time,About half the time,Sometimes,Never,,,,
"The environment (e.g., any physical or ecological aspect of a system)",22,45,32,51,5,67,155,,0.432258065
"The evidence (e.g., existing knowledge on an intervention or management strategy)",15,50,28,56,6,65,155,,0.419354839
"The actions or decisions of teammates, and/or colleagues",5,25,30,87,8,30,155,,0.193548387
The actions or decisions of leaders of my agency or organization,13,33,31,69,9,46,155,,0.296774194
The actions or decisions of elected leaders,39,57,31,26,2,96,155,,0.619354839
The actions or decisions of stakeholders or rightsholders.,16,49,51,38,1,65,155,,0.419354839
"Funding (e.g., availability and timelines)",37,55,27,31,5,92,155,,0.593548387
